{
  "contract_version": "1.0.0",
  "entry": "foreach.items",
  "error_routes": [],
  "id": "program.conformance-collection-flow",
  "imports": [
    {
      "alias": "worker",
      "digest": "sha256:b79e42065385e3a82b9e5c41281ac5098398ee645bf9983332ea4678bb9c0317",
      "ref": "program.conformance-worker"
    }
  ],
  "inputs": [
    {
      "id": "items",
      "type": {
        "items": "string",
        "kind": "list"
      }
    }
  ],
  "nodes": [
    {
      "id": "foreach.items",
      "item": "item",
      "items": {
        "op": "ref",
        "path": "input.items"
      },
      "kind": "foreach",
      "max_iterations": 8,
      "next": "parallel.items",
      "program": "worker",
      "result": "each_results"
    },
    {
      "branches": [
        {
          "id": "second",
          "input": {
            "item": {
              "op": "literal",
              "value": "B"
            }
          },
          "program": "worker"
        },
        {
          "id": "first",
          "input": {
            "item": {
              "op": "literal",
              "value": "A"
            }
          },
          "program": "worker"
        }
      ],
      "id": "parallel.items",
      "kind": "parallel",
      "max_parallel": 2,
      "merge": "object",
      "next": "return.results",
      "result": "parallel_results"
    },
    {
      "id": "return.results",
      "kind": "return",
      "values": {
        "each_results": {
          "op": "ref",
          "path": "state.each_results"
        },
        "parallel_results": {
          "op": "ref",
          "path": "state.parallel_results"
        }
      }
    }
  ],
  "outputs": [
    {
      "id": "each_results",
      "type": {
        "items": {
          "fields": {
            "value": "string"
          },
          "kind": "record"
        },
        "kind": "list"
      }
    },
    {
      "id": "parallel_results",
      "type": {
        "kind": "map",
        "values": {
          "fields": {
            "value": "string"
          },
          "kind": "record"
        }
      }
    }
  ],
  "policies": {
    "allowed_effects": [
      "pure"
    ],
    "budgets": {
      "max_depth": 8,
      "max_duration_ms": 100,
      "max_iterations": 16,
      "max_parallel": 4,
      "max_steps": 64
    },
    "canonical_write_allowed": false
  },
  "source_map": {
    "foreach.items": {
      "file": "collection-flow.mirai.yaml",
      "line": 46
    },
    "parallel.items": {
      "file": "collection-flow.mirai.yaml",
      "line": 56
    },
    "return.results": {
      "file": "collection-flow.mirai.yaml",
      "line": 75
    }
  },
  "state": [
    {
      "default": [],
      "id": "each_results",
      "type": {
        "items": {
          "fields": {
            "value": "string"
          },
          "kind": "record"
        },
        "kind": "list"
      }
    },
    {
      "default": {},
      "id": "parallel_results",
      "type": {
        "kind": "map",
        "values": {
          "fields": {
            "value": "string"
          },
          "kind": "record"
        }
      }
    }
  ],
  "version": "1.0.0",
  "digest": "sha256:8bd265014755bac3d4f0c819ecf44ff6ac76efbb933aa70d980478af5b81d2b6"
}
