{
  "contract_version": "1.0.0",
  "entry": "retry.failing",
  "error_routes": [],
  "id": "program.conformance-retry",
  "imports": [
    {
      "alias": "failing",
      "digest": "sha256:89b85e1687023764677079891366fe3f93abd109e119aa3f95935913dadde3d7",
      "ref": "program.conformance-failing"
    }
  ],
  "inputs": [],
  "nodes": [
    {
      "backoff_ms": 0,
      "id": "retry.failing",
      "kind": "retry",
      "max_attempts": 3,
      "next": "return.unexpected",
      "on_error": "return.failed",
      "program": "failing",
      "timeout_ms": 10
    },
    {
      "id": "return.failed",
      "kind": "return",
      "values": {
        "status": {
          "op": "literal",
          "value": "failed"
        }
      }
    },
    {
      "id": "return.unexpected",
      "kind": "return",
      "values": {
        "status": {
          "op": "literal",
          "value": "unexpected"
        }
      }
    }
  ],
  "outputs": [
    {
      "id": "status",
      "type": "string"
    }
  ],
  "policies": {
    "allowed_effects": [
      "pure"
    ],
    "budgets": {
      "max_depth": 8,
      "max_duration_ms": 100,
      "max_iterations": 8,
      "max_parallel": 4,
      "max_steps": 32
    },
    "canonical_write_allowed": false
  },
  "source_map": {
    "retry.failing": {
      "file": "retry.mirai.yaml",
      "line": 14
    },
    "return.failed": {
      "file": "retry.mirai.yaml",
      "line": 22
    },
    "return.unexpected": {
      "file": "retry.mirai.yaml",
      "line": 28
    }
  },
  "state": [],
  "version": "1.0.0",
  "digest": "sha256:c4b3a36ebeda1dcc5d64206d1cd2f4e2339a7d1146f1f205934fb3ad86b62d25"
}
